{
  "schemaVersion": 1,
  "id": "first_module",
  "name": "First Module",
  "version": "1.0.0",
  "author": "YourName",
  "apiVersion": 4,
  "hzkmacrosVersion": ">=0.26.0-beta.94",
  "entrypoint": "com.example.firstmodule.FirstModule",
  "documentation": {
    "en_us": "docs/en_us.json",
    "pt_br": "docs/pt_br.json"
  },
  "dependencies": {
    "fabricMods": [],
    "optionalFabricMods": [],
    "modules": [],
    "optionalModules": []
  }
}
